{
  "actual_outcome": "SUCCESS",
  "case_id": "T2A02",
  "duration_ms": 576,
  "evidence": [
    {
      "bytes": 173,
      "path": "artifacts/ledger/opencode_dogfood/RUN_0003/evidence/T2A02/git_status.txt",
      "sha256": "20ea841f14044faf74c205f4af9dd48f5fc559d7defe51e88998ac98b558077b"
    },
    {
      "bytes": 97,
      "path": "artifacts/ledger/opencode_dogfood/RUN_0003/evidence/T2A02/item_01.txt",
      "sha256": "c78677cde2d2bcaf7d4b32dd27fe6b8b7a61bbde0ff712b5b67493442d1856a0"
    },
    {
      "bytes": 40,
      "path": "artifacts/ledger/opencode_dogfood/RUN_0003/evidence/T2A02/repo_commit.txt",
      "sha256": "789e12978ced2381b92759a4e6b948e89e9c7d0191cb72aa8eb9c4c466be1ed3"
    },
    {
      "bytes": 0,
      "path": "artifacts/ledger/opencode_dogfood/RUN_0003/evidence/T2A02/stderr.txt",
      "sha256": "e3b0c44298fc1c149afbf4c8996fb92427ae41e4649b934ca495991b7852b855"
    },
    {
      "bytes": 122,
      "path": "artifacts/ledger/opencode_dogfood/RUN_0003/evidence/T2A02/stdout.txt",
      "sha256": "aee695d08b8a4a54583a3b938338168e68808fe634c1468187f96dc1dee8c558"
    },
    {
      "bytes": 111,
      "path": "artifacts/ledger/opencode_dogfood/RUN_0003/evidence/T2A02/worktree_check.txt",
      "sha256": "a380e11904cbf1097fa8a299508ccfba944261fdf2e9ac5aacb3145f45603560"
    }
  ],
  "expected_outcome": "SUCCESS",
  "failure_code": null,
  "model_id": "unknown",
  "repo_commit": "f8bcc676bd096dc0932414eecca7a88f48cf28a7",
  "run_id": "RUN_0003",
  "schema_id": "opencode_dogfood_case_result",
  "schema_version": "1.0",
  "stage": "T2a",
  "status": "PASS",
  "transport": "unknown"
}