{
  "actual_outcome": "SUCCESS",
  "case_id": "T2A03",
  "duration_ms": 581,
  "evidence": [
    {
      "bytes": 238,
      "path": "artifacts/ledger/opencode_dogfood/RUN_0003/evidence/T2A03/git_status.txt",
      "sha256": "2107515d73b19934d46f235ea0bd27c462d3bb8f88bc5311574ab7be94d969eb"
    },
    {
      "bytes": 77,
      "path": "artifacts/ledger/opencode_dogfood/RUN_0003/evidence/T2A03/item_01.txt",
      "sha256": "d11393cdfb1051d56e9e040c5880f137e214fd0a41636a61c8daf8702de17f03"
    },
    {
      "bytes": 40,
      "path": "artifacts/ledger/opencode_dogfood/RUN_0003/evidence/T2A03/repo_commit.txt",
      "sha256": "789e12978ced2381b92759a4e6b948e89e9c7d0191cb72aa8eb9c4c466be1ed3"
    },
    {
      "bytes": 0,
      "path": "artifacts/ledger/opencode_dogfood/RUN_0003/evidence/T2A03/stderr.txt",
      "sha256": "e3b0c44298fc1c149afbf4c8996fb92427ae41e4649b934ca495991b7852b855"
    },
    {
      "bytes": 102,
      "path": "artifacts/ledger/opencode_dogfood/RUN_0003/evidence/T2A03/stdout.txt",
      "sha256": "fca20badd9f6b5cd57b4879e1d2d705b0b0ac67f8086116788b617f7df091565"
    },
    {
      "bytes": 111,
      "path": "artifacts/ledger/opencode_dogfood/RUN_0003/evidence/T2A03/worktree_check.txt",
      "sha256": "a380e11904cbf1097fa8a299508ccfba944261fdf2e9ac5aacb3145f45603560"
    }
  ],
  "expected_outcome": "SUCCESS",
  "failure_code": null,
  "model_id": "unknown",
  "repo_commit": "f8bcc676bd096dc0932414eecca7a88f48cf28a7",
  "run_id": "RUN_0003",
  "schema_id": "opencode_dogfood_case_result",
  "schema_version": "1.0",
  "stage": "T2a",
  "status": "PASS",
  "transport": "unknown"
}