{
  "actual_outcome": "SUCCESS",
  "case_id": "T1C01",
  "duration_ms": 14525,
  "evidence": [
    {
      "bytes": 2156,
      "path": "artifacts/ledger/opencode_dogfood/RUN_0002/evidence/T1C01/git_status.txt",
      "sha256": "d459c615f125bf28061ee20d0d57da1bbb7f9a1497fdd9da1d443d389fa1230e"
    },
    {
      "bytes": 483,
      "path": "artifacts/ledger/opencode_dogfood/RUN_0002/evidence/T1C01/item_01.json",
      "sha256": "d281f28d356c9a8f76c96381d41bc63dc42286866fc664be8a50ec5d31a97c02"
    },
    {
      "bytes": 40,
      "path": "artifacts/ledger/opencode_dogfood/RUN_0002/evidence/T1C01/repo_commit.txt",
      "sha256": "54cc50984dc9a3af0b976535f26c6baf0adee8c841f9c8843c1d3db13f4a6e8e"
    },
    {
      "bytes": 0,
      "path": "artifacts/ledger/opencode_dogfood/RUN_0002/evidence/T1C01/stderr.txt",
      "sha256": "e3b0c44298fc1c149afbf4c8996fb92427ae41e4649b934ca495991b7852b855"
    },
    {
      "bytes": 140,
      "path": "artifacts/ledger/opencode_dogfood/RUN_0002/evidence/T1C01/stdout.txt",
      "sha256": "c8ec9d869beb2d7ed6679419d20a0ce4cb2ed37633ccb989db7540efceedca28"
    },
    {
      "bytes": 53,
      "path": "artifacts/ledger/opencode_dogfood/RUN_0002/evidence/T1C01/worktree_check.txt",
      "sha256": "c81509e3e32b5a7d03f0ee8a501dc66e20145e36a6060713b1fbc5bd35406d1e"
    }
  ],
  "expected_outcome": "SUCCESS",
  "failure_code": null,
  "model_id": "unknown",
  "repo_commit": "78af6649abd0f0d6935953d11ee8e21e2b694e5b",
  "run_id": "RUN_0002",
  "schema_id": "opencode_dogfood_case_result",
  "schema_version": "1.0",
  "stage": "T1",
  "status": "PASS",
  "transport": "unknown"
}