{
  "actual_outcome": "SUCCESS",
  "case_id": "T2A01",
  "duration_ms": 756,
  "evidence": [
    {
      "bytes": 106,
      "path": "artifacts/ledger/opencode_dogfood/RUN_0003/evidence/T2A01/git_status.txt",
      "sha256": "f7490f94eacedc165ed8806b5bdd53ce610e55a5df11c5af753d2cba6e4da165"
    },
    {
      "bytes": 72,
      "path": "artifacts/ledger/opencode_dogfood/RUN_0003/evidence/T2A01/item_01.txt",
      "sha256": "631b05e39f498f9433c49fc8040705df562dad43df011e0ac3cfabc83a39098b"
    },
    {
      "bytes": 40,
      "path": "artifacts/ledger/opencode_dogfood/RUN_0003/evidence/T2A01/repo_commit.txt",
      "sha256": "789e12978ced2381b92759a4e6b948e89e9c7d0191cb72aa8eb9c4c466be1ed3"
    },
    {
      "bytes": 0,
      "path": "artifacts/ledger/opencode_dogfood/RUN_0003/evidence/T2A01/stderr.txt",
      "sha256": "e3b0c44298fc1c149afbf4c8996fb92427ae41e4649b934ca495991b7852b855"
    },
    {
      "bytes": 97,
      "path": "artifacts/ledger/opencode_dogfood/RUN_0003/evidence/T2A01/stdout.txt",
      "sha256": "eb296d537598c2bf2bee7e23785ef7d2c3f8b5dadc26853a77996ecb76edc8fd"
    },
    {
      "bytes": 111,
      "path": "artifacts/ledger/opencode_dogfood/RUN_0003/evidence/T2A01/worktree_check.txt",
      "sha256": "a380e11904cbf1097fa8a299508ccfba944261fdf2e9ac5aacb3145f45603560"
    }
  ],
  "expected_outcome": "SUCCESS",
  "failure_code": null,
  "model_id": "unknown",
  "repo_commit": "f8bcc676bd096dc0932414eecca7a88f48cf28a7",
  "run_id": "RUN_0003",
  "schema_id": "opencode_dogfood_case_result",
  "schema_version": "1.0",
  "stage": "T2a",
  "status": "PASS",
  "transport": "unknown"
}