{
  "actual_outcome": "SUCCESS",
  "case_id": "T2A01",
  "duration_ms": 327,
  "evidence": [
    {
      "bytes": 2223,
      "path": "artifacts/ledger/opencode_dogfood/RUN_0002/evidence/T2A01/git_status.txt",
      "sha256": "241835f52d56d7517ee744c65798af1b1558b0be5f24682e8b315ea07a1215e7"
    },
    {
      "bytes": 72,
      "path": "artifacts/ledger/opencode_dogfood/RUN_0002/evidence/T2A01/item_01.txt",
      "sha256": "631b05e39f498f9433c49fc8040705df562dad43df011e0ac3cfabc83a39098b"
    },
    {
      "bytes": 40,
      "path": "artifacts/ledger/opencode_dogfood/RUN_0002/evidence/T2A01/repo_commit.txt",
      "sha256": "54cc50984dc9a3af0b976535f26c6baf0adee8c841f9c8843c1d3db13f4a6e8e"
    },
    {
      "bytes": 0,
      "path": "artifacts/ledger/opencode_dogfood/RUN_0002/evidence/T2A01/stderr.txt",
      "sha256": "e3b0c44298fc1c149afbf4c8996fb92427ae41e4649b934ca495991b7852b855"
    },
    {
      "bytes": 97,
      "path": "artifacts/ledger/opencode_dogfood/RUN_0002/evidence/T2A01/stdout.txt",
      "sha256": "eb296d537598c2bf2bee7e23785ef7d2c3f8b5dadc26853a77996ecb76edc8fd"
    },
    {
      "bytes": 54,
      "path": "artifacts/ledger/opencode_dogfood/RUN_0002/evidence/T2A01/worktree_check.txt",
      "sha256": "014a12926ba70a874404dd293b6fa2a445d75b101c0268462ef8ddaaf0359eb0"
    }
  ],
  "expected_outcome": "SUCCESS",
  "failure_code": null,
  "model_id": "unknown",
  "repo_commit": "78af6649abd0f0d6935953d11ee8e21e2b694e5b",
  "run_id": "RUN_0002",
  "schema_id": "opencode_dogfood_case_result",
  "schema_version": "1.0",
  "stage": "T2a",
  "status": "PASS",
  "transport": "unknown"
}