{
  "actual_outcome": "SUCCESS",
  "case_id": "T2A02",
  "duration_ms": 294,
  "evidence": [
    {
      "bytes": 2290,
      "path": "artifacts/ledger/opencode_dogfood/RUN_0002/evidence/T2A02/git_status.txt",
      "sha256": "33be32050f2618576cbd92c3e1ce9f57a9b088181bfae3e0d63b7d71ae4b4ef6"
    },
    {
      "bytes": 97,
      "path": "artifacts/ledger/opencode_dogfood/RUN_0002/evidence/T2A02/item_01.txt",
      "sha256": "c78677cde2d2bcaf7d4b32dd27fe6b8b7a61bbde0ff712b5b67493442d1856a0"
    },
    {
      "bytes": 40,
      "path": "artifacts/ledger/opencode_dogfood/RUN_0002/evidence/T2A02/repo_commit.txt",
      "sha256": "54cc50984dc9a3af0b976535f26c6baf0adee8c841f9c8843c1d3db13f4a6e8e"
    },
    {
      "bytes": 0,
      "path": "artifacts/ledger/opencode_dogfood/RUN_0002/evidence/T2A02/stderr.txt",
      "sha256": "e3b0c44298fc1c149afbf4c8996fb92427ae41e4649b934ca495991b7852b855"
    },
    {
      "bytes": 122,
      "path": "artifacts/ledger/opencode_dogfood/RUN_0002/evidence/T2A02/stdout.txt",
      "sha256": "aee695d08b8a4a54583a3b938338168e68808fe634c1468187f96dc1dee8c558"
    },
    {
      "bytes": 54,
      "path": "artifacts/ledger/opencode_dogfood/RUN_0002/evidence/T2A02/worktree_check.txt",
      "sha256": "014a12926ba70a874404dd293b6fa2a445d75b101c0268462ef8ddaaf0359eb0"
    }
  ],
  "expected_outcome": "SUCCESS",
  "failure_code": null,
  "model_id": "unknown",
  "repo_commit": "78af6649abd0f0d6935953d11ee8e21e2b694e5b",
  "run_id": "RUN_0002",
  "schema_id": "opencode_dogfood_case_result",
  "schema_version": "1.0",
  "stage": "T2a",
  "status": "PASS",
  "transport": "unknown"
}